{
  "evidence_root": "/home/workdir/peakflow-topanga-census-prep-validation",
  "executable": {
    "path": "/home/workdir/wepp-forest_260430_baseline/src/wepp_hill",
    "sha256": "2ec15778df957f909da383df9e3e0c9b516688d367c11f0109c6012387c0731f"
  },
  "input_authorities": [
    {
      "authority": "/wc1/runs/ha/hand-to-mouth-drought/wepp",
      "input_tree_sha256": "b0968d699147ef982888923985fcfd9e32330c576e5d9fbe61a0ed461d65a155",
      "scenario": "burned"
    },
    {
      "authority": "/wc1/runs/ha/hand-to-mouth-drought/_pups/omni/scenarios/undisturbed/wepp",
      "input_tree_sha256": "58944cc4f378d473fe18d87101e579976a9cbd5a549cbed71f7372e033740b45",
      "scenario": "undisturbed"
    }
  ],
  "manifest_sha256": "c9bc5623c8b32be6f62f701cc3fffab332e8555247286aab18e9ccc81b10bf89",
  "plan_id": "2a19c6e0b1cef1b4bbcf0c50844f01a74393881e0c690d3f5816859352b9e747",
  "schema_version": "1.0.0",
  "site": "topanga-pilot-validation",
  "study_id": "c9bc5623c8b32be6f62f701cc3fffab332e8555247286aab18e9ccc81b10bf89",
  "totals": {
    "by_family": {
      "cover": {
        "eligible": 32,
        "excluded": 0,
        "requested": 32
      },
      "ksat": {
        "eligible": 32,
        "excluded": 0,
        "requested": 32
      }
    },
    "by_scenario": {
      "burned": {
        "eligible": 32,
        "excluded": 0,
        "requested": 32
      },
      "undisturbed": {
        "eligible": 32,
        "excluded": 0,
        "requested": 32
      }
    },
    "eligible": 64,
    "excluded": 0,
    "exclusion_reasons": {},
    "requested": 64
  },
  "trials": [
    {
      "direction": "minus",
      "eligibility": "eligible",
      "evidence_locator": "2a19c6e0b1cef1b4bbcf0c50844f01a74393881e0c690d3f5816859352b9e747/burned/h106/ksat-minus",
      "exclusion_reason": null,
      "expected_value": 19.8,
      "family": "ksat",
      "hillslope_id": 106,
      "input_sha256": "aece24f649724620a8454ac14b0004216bf8b0d86e616a33d70ab9fe80e7a618",
      "lines": [
        88
      ],
      "parameter": "first_horizon_ksat_mm_h",
      "relative_input": "p106.sol",
      "requested_change": 0.99,
      "scenario": "burned",
      "site": "topanga-pilot-validation",
      "source_value": 20.0,
      "tokens": [
        3
      ],
      "trial_id": "topanga-pilot-validation-burned-h106-ksat-minus-2a19c6e0b1ce"
    },
    {
      "direction": "plus",
      "eligibility": "eligible",
      "evidence_locator": "2a19c6e0b1cef1b4bbcf0c50844f01a74393881e0c690d3f5816859352b9e747/burned/h106/ksat-plus",
      "exclusion_reason": null,
      "expected_value": 20.2,
      "family": "ksat",
      "hillslope_id": 106,
      "input_sha256": "aece24f649724620a8454ac14b0004216bf8b0d86e616a33d70ab9fe80e7a618",
      "lines": [
        88
      ],
      "parameter": "first_horizon_ksat_mm_h",
      "relative_input": "p106.sol",
      "requested_change": 1.01,
      "scenario": "burned",
      "site": "topanga-pilot-validation",
      "source_value": 20.0,
      "tokens": [
        3
      ],
      "trial_id": "topanga-pilot-validation-burned-h106-ksat-plus-2a19c6e0b1ce"
    },
    {
      "direction": "minus",
      "eligibility": "eligible",
      "evidence_locator": "2a19c6e0b1cef1b4bbcf0c50844f01a74393881e0c690d3f5816859352b9e747/burned/h106/cover-minus",
      "exclusion_reason": null,
      "expected_value": {
        "inrcov": 0.54,
        "rilcov": 0.54
      },
      "family": "cover",
      "hillslope_id": 106,
      "input_sha256": "17e8fc29e972ea9ff2b1be93d3f08c66e91809cf67900b3f5d02fad0a34cbbde",
      "lines": [
        35,
        38
      ],
      "parameter": "paired_inrcov_rilcov",
      "relative_input": "p106.man",
      "requested_change": -0.01,
      "scenario": "burned",
      "site": "topanga-pilot-validation",
      "source_value": {
        "inrcov": 0.55,
        "rilcov": 0.55
      },
      "tokens": [
        6,
        3
      ],
      "trial_id": "topanga-pilot-validation-burned-h106-cover-minus-2a19c6e0b1ce"
    },
    {
      "direction": "plus",
      "eligibility": "eligible",
      "evidence_locator": "2a19c6e0b1cef1b4bbcf0c50844f01a74393881e0c690d3f5816859352b9e747/burned/h106/cover-plus",
      "exclusion_reason": null,
      "expected_value": {
        "inrcov": 0.56,
        "rilcov": 0.56
      },
      "family": "cover",
      "hillslope_id": 106,
      "input_sha256": "17e8fc29e972ea9ff2b1be93d3f08c66e91809cf67900b3f5d02fad0a34cbbde",
      "lines": [
        35,
        38
      ],
      "parameter": "paired_inrcov_rilcov",
      "relative_input": "p106.man",
      "requested_change": 0.01,
      "scenario": "burned",
      "site": "topanga-pilot-validation",
      "source_value": {
        "inrcov": 0.55,
        "rilcov": 0.55
      },
      "tokens": [
        6,
        3
      ],
      "trial_id": "topanga-pilot-validation-burned-h106-cover-plus-2a19c6e0b1ce"
    },
    {
      "direction": "minus",
      "eligibility": "eligible",
      "evidence_locator": "2a19c6e0b1cef1b4bbcf0c50844f01a74393881e0c690d3f5816859352b9e747/burned/h84/ksat-minus",
      "exclusion_reason": null,
      "expected_value": 19.8,
      "family": "ksat",
      "hillslope_id": 84,
      "input_sha256": "20e13c70429b97bfb49a3821375de7e8a1a5af582f77d686080be7c150095c7c",
      "lines": [
        92
      ],
      "parameter": "first_horizon_ksat_mm_h",
      "relative_input": "p84.sol",
      "requested_change": 0.99,
      "scenario": "burned",
      "site": "topanga-pilot-validation",
      "source_value": 20.0,
      "tokens": [
        3
      ],
      "trial_id": "topanga-pilot-validation-burned-h84-ksat-minus-2a19c6e0b1ce"
    },
    {
      "direction": "plus",
      "eligibility": "eligible",
      "evidence_locator": "2a19c6e0b1cef1b4bbcf0c50844f01a74393881e0c690d3f5816859352b9e747/burned/h84/ksat-plus",
      "exclusion_reason": null,
      "expected_value": 20.2,
      "family": "ksat",
      "hillslope_id": 84,
      "input_sha256": "20e13c70429b97bfb49a3821375de7e8a1a5af582f77d686080be7c150095c7c",
      "lines": [
        92
      ],
      "parameter": "first_horizon_ksat_mm_h",
      "relative_input": "p84.sol",
      "requested_change": 1.01,
      "scenario": "burned",
      "site": "topanga-pilot-validation",
      "source_value": 20.0,
      "tokens": [
        3
      ],
      "trial_id": "topanga-pilot-validation-burned-h84-ksat-plus-2a19c6e0b1ce"
    },
    {
      "direction": "minus",
      "eligibility": "eligible",
      "evidence_locator": "2a19c6e0b1cef1b4bbcf0c50844f01a74393881e0c690d3f5816859352b9e747/burned/h84/cover-minus",
      "exclusion_reason": null,
      "expected_value": {
        "inrcov": 0.79,
        "rilcov": 0.79
      },
      "family": "cover",
      "hillslope_id": 84,
      "input_sha256": "db0e050d3224436bd269427af23750f0c72831f9aeb642e5495ad1be18a92302",
      "lines": [
        35,
        38
      ],
      "parameter": "paired_inrcov_rilcov",
      "relative_input": "p84.man",
      "requested_change": -0.01,
      "scenario": "burned",
      "site": "topanga-pilot-validation",
      "source_value": {
        "inrcov": 0.8,
        "rilcov": 0.8
      },
      "tokens": [
        6,
        3
      ],
      "trial_id": "topanga-pilot-validation-burned-h84-cover-minus-2a19c6e0b1ce"
    },
    {
      "direction": "plus",
      "eligibility": "eligible",
      "evidence_locator": "2a19c6e0b1cef1b4bbcf0c50844f01a74393881e0c690d3f5816859352b9e747/burned/h84/cover-plus",
      "exclusion_reason": null,
      "expected_value": {
        "inrcov": 0.81,
        "rilcov": 0.81
      },
      "family": "cover",
      "hillslope_id": 84,
      "input_sha256": "db0e050d3224436bd269427af23750f0c72831f9aeb642e5495ad1be18a92302",
      "lines": [
        35,
        38
      ],
      "parameter": "paired_inrcov_rilcov",
      "relative_input": "p84.man",
      "requested_change": 0.01,
      "scenario": "burned",
      "site": "topanga-pilot-validation",
      "source_value": {
        "inrcov": 0.8,
        "rilcov": 0.8
      },
      "tokens": [
        6,
        3
      ],
      "trial_id": "topanga-pilot-validation-burned-h84-cover-plus-2a19c6e0b1ce"
    },
    {
      "direction": "minus",
      "eligibility": "eligible",
      "evidence_locator": "2a19c6e0b1cef1b4bbcf0c50844f01a74393881e0c690d3f5816859352b9e747/burned/h8/ksat-minus",
      "exclusion_reason": null,
      "expected_value": 19.8,
      "family": "ksat",
      "hillslope_id": 8,
      "input_sha256": "1eba3736466d67b2ef62c2ccc092f09dc5ece5bae8b79908f76d80455b51d287",
      "lines": [
        88
      ],
      "parameter": "first_horizon_ksat_mm_h",
      "relative_input": "p8.sol",
      "requested_change": 0.99,
      "scenario": "burned",
      "site": "topanga-pilot-validation",
      "source_value": 20.0,
      "tokens": [
        3
      ],
      "trial_id": "topanga-pilot-validation-burned-h8-ksat-minus-2a19c6e0b1ce"
    },
    {
      "direction": "plus",
      "eligibility": "eligible",
      "evidence_locator": "2a19c6e0b1cef1b4bbcf0c50844f01a74393881e0c690d3f5816859352b9e747/burned/h8/ksat-plus",
      "exclusion_reason": null,
      "expected_value": 20.2,
      "family": "ksat",
      "hillslope_id": 8,
      "input_sha256": "1eba3736466d67b2ef62c2ccc092f09dc5ece5bae8b79908f76d80455b51d287",
      "lines": [
        88
      ],
      "parameter": "first_horizon_ksat_mm_h",
      "relative_input": "p8.sol",
      "requested_change": 1.01,
      "scenario": "burned",
      "site": "topanga-pilot-validation",
      "source_value": 20.0,
      "tokens": [
        3
      ],
      "trial_id": "topanga-pilot-validation-burned-h8-ksat-plus-2a19c6e0b1ce"
    },
    {
      "direction": "minus",
      "eligibility": "eligible",
      "evidence_locator": "2a19c6e0b1cef1b4bbcf0c50844f01a74393881e0c690d3f5816859352b9e747/burned/h8/cover-minus",
      "exclusion_reason": null,
      "expected_value": {
        "inrcov": 0.79,
        "rilcov": 0.79
      },
      "family": "cover",